{
  "schema": "invar-examples-index-v1",
  "spec": "docs/spec/invar-v0.1.md",
  "pending_families": [],
  "examples": [
    {
      "path": "examples/bytes/byte-index-trap.inv",
      "intent": "Indexing Bytes out of range traps with INDEX_OUT_OF_BOUNDS.",
      "family": "bytes-text",
      "tags": [
        "bytes",
        "trap"
      ],
      "spec_section": "7.1",
      "engines": [
        "reference",
        "mir",
        "native-serial"
      ],
      "expect": {
        "command": "run",
        "status": "trap",
        "category": "INDEX_OUT_OF_BOUNDS"
      }
    },
    {
      "path": "examples/bytes/bytes-and-text.inv",
      "intent": "Byte and string literals with escapes and byte lengths.",
      "family": "bytes-text",
      "tags": [
        "bytes"
      ],
      "spec_section": "7.1",
      "engines": [
        "reference",
        "mir",
        "native-serial"
      ],
      "expect": {
        "command": "run",
        "status": "ok",
        "value": 7
      }
    },
    {
      "path": "examples/bytes/foreign-buffers.inv",
      "intent": "Foreign declaration passing read and take buffers.",
      "family": "c-abi",
      "tags": [
        "buffers",
        "foreign"
      ],
      "spec_section": "7.3",
      "engines": [
        "reference",
        "mir"
      ],
      "expect": {
        "command": "run",
        "status": "ok",
        "value": 7
      }
    },
    {
      "path": "examples/bytes/foreign-callback.inv",
      "intent": "Callbacks in a foreign signature are rejected.",
      "family": "c-abi",
      "tags": [
        "foreign",
        "negative"
      ],
      "spec_section": "7.3",
      "engines": [
        "check"
      ],
      "expect": {
        "command": "check",
        "status": "source_error",
        "code": "TYPE_MISMATCH"
      }
    },
    {
      "path": "examples/bytes/foreign-oracle.inv",
      "intent": "A foreign declaration whose Invar oracle runs on the reference engine.",
      "family": "c-abi",
      "tags": [
        "foreign"
      ],
      "spec_section": "7.3",
      "engines": [
        "reference",
        "mir"
      ],
      "expect": {
        "command": "run",
        "status": "ok",
        "value": 7
      }
    },
    {
      "path": "examples/bytes/foreign-use-after-take.inv",
      "intent": "A take argument is consumed so a later use is OWN_USE_AFTER_MOVE.",
      "family": "c-abi",
      "tags": [
        "foreign",
        "negative"
      ],
      "spec_section": "7.3",
      "engines": [
        "check"
      ],
      "expect": {
        "command": "check",
        "status": "source_error",
        "code": "OWN_USE_AFTER_MOVE"
      }
    },
    {
      "path": "examples/bytes/utf8-decode-error.inv",
      "intent": "Malformed UTF-8 is an ordinary Err value and not a trap.",
      "family": "bytes-text",
      "tags": [
        "result",
        "utf8"
      ],
      "spec_section": "7.2",
      "engines": [
        "reference",
        "mir",
        "native-serial"
      ],
      "expect": {
        "command": "run",
        "status": "ok",
        "value": 1
      }
    },
    {
      "path": "examples/bytes/utf8-decode.inv",
      "intent": "utf8_decode accepts valid UTF-8 and returns a String.",
      "family": "bytes-text",
      "tags": [
        "utf8"
      ],
      "spec_section": "7.2",
      "engines": [
        "reference",
        "mir",
        "native-serial"
      ],
      "expect": {
        "command": "run",
        "status": "ok",
        "value": 7
      }
    },
    {
      "path": "examples/bytes/utf8-slices.inv",
      "intent": "bytes_slice and utf8_slice borrow a named owner and copy a range.",
      "family": "bytes-text",
      "tags": [
        "utf8"
      ],
      "spec_section": "7.2",
      "engines": [
        "reference",
        "mir",
        "native-serial"
      ],
      "expect": {
        "command": "run",
        "status": "ok",
        "value": 7
      }
    },
    {
      "path": "examples/cells/menagerie-panda.inv",
      "intent": "A cell selecting the Franka Panda robot model.",
      "family": "cell",
      "tags": [
        "cell",
        "robot"
      ],
      "spec_section": "8.1",
      "engines": [
        "system"
      ],
      "expect": {
        "command": "system",
        "status": "ok",
        "diagnostics": [],
        "ir_sha256": "5d3836b9fd425e2379249092b4001d5fd8dc7044fcfd73b1f85428d62a068aae"
      }
    },
    {
      "path": "examples/cells/menagerie-ur5e.inv",
      "intent": "A cell selecting the UR5e robot model.",
      "family": "cell",
      "tags": [
        "cell",
        "robot"
      ],
      "spec_section": "8.1",
      "engines": [
        "system"
      ],
      "expect": {
        "command": "system",
        "status": "ok",
        "diagnostics": [],
        "ir_sha256": "422291d902bee96e02724de418159cf105c556aaf0ca07e747949cf3366d0d8f"
      }
    },
    {
      "path": "examples/cells/reach_place/cell-ur5e.inv",
      "intent": "The reach and place cell for the UR5e with ROS 2 generation.",
      "family": "cell",
      "tags": [
        "cell",
        "generate"
      ],
      "spec_section": "10.3",
      "engines": [
        "system",
        "generate"
      ],
      "expect": {
        "command": "system",
        "status": "ok",
        "diagnostics": [
          "S1011:warning"
        ],
        "ir_sha256": "b062fd3edef93309e0e77b17def51891c3252339710dcc1840ae1eb6bb612c07",
        "generate": [
          {
            "target": "ros2",
            "files": 35,
            "tree_sha256": "089059ca1dbda315f106b970979a63f8f075d2c5db1ed54a514c815c4bc1fc18"
          },
          {
            "target": "mjcf",
            "files": 2,
            "tree_sha256": "9d714c10aa0bacb49368d6d6f3869f867eb4cf1a9cf2ac2bff171baa959c3c04"
          }
        ]
      }
    },
    {
      "path": "examples/cells/reach_place/cell.inv",
      "intent": "A reach and place cell importing recorded foreign components, with ROS 2 and MJCF generation.",
      "family": "cell",
      "tags": [
        "cell",
        "generate"
      ],
      "spec_section": "10.3",
      "engines": [
        "system",
        "generate"
      ],
      "expect": {
        "command": "system",
        "status": "ok",
        "diagnostics": [
          "S1011:warning"
        ],
        "ir_sha256": "5315d1b931aa0c9bf7375767bf93d634e195a1971e2c7d302f1558253d3db8ad",
        "generate": [
          {
            "target": "ros2",
            "files": 47,
            "tree_sha256": "fb2e466b99a9f59ba783cb1b1ff9ebbd683beb81208afa5a6930803b7cc7045f"
          },
          {
            "target": "mjcf",
            "files": 14,
            "tree_sha256": "358f88397b5e8c93b02483ae20d8b8675d7c4e2a12448e5fb79e569126f0340e"
          }
        ]
      }
    },
    {
      "path": "examples/cells/reach_place/components/curobo_planner/manifest-source-panda-v3.inv",
      "intent": "Foreign component manifest curobo_planner manifest-source-panda-v3 that checks standalone.",
      "family": "foreign-manifest",
      "tags": [
        "manifest"
      ],
      "spec_section": "10.1",
      "engines": [
        "check"
      ],
      "expect": {
        "command": "check",
        "status": "ok"
      }
    },
    {
      "path": "examples/cells/reach_place/components/curobo_planner/manifest-source-ur5e-v3.inv",
      "intent": "Foreign component manifest curobo_planner manifest-source-ur5e-v3 that checks standalone.",
      "family": "foreign-manifest",
      "tags": [
        "manifest"
      ],
      "spec_section": "10.1",
      "engines": [
        "check"
      ],
      "expect": {
        "command": "check",
        "status": "ok"
      }
    },
    {
      "path": "examples/cells/reach_place/components/curobo_planner/manifest-ur5e.inv",
      "intent": "Foreign component manifest curobo_planner manifest-ur5e that checks standalone.",
      "family": "foreign-manifest",
      "tags": [
        "manifest"
      ],
      "spec_section": "10.1",
      "engines": [
        "check"
      ],
      "expect": {
        "command": "check",
        "status": "ok"
      }
    },
    {
      "path": "examples/cells/reach_place/components/curobo_planner/manifest.inv",
      "intent": "Foreign component manifest curobo_planner manifest that checks standalone.",
      "family": "foreign-manifest",
      "tags": [
        "manifest"
      ],
      "spec_section": "10.1",
      "engines": [
        "check"
      ],
      "expect": {
        "command": "check",
        "status": "ok"
      }
    },
    {
      "path": "examples/cells/reach_place/components/pinocchio_fk/manifest-unrecorded.inv",
      "intent": "Foreign component manifest pinocchio_fk manifest-unrecorded that checks standalone.",
      "family": "foreign-manifest",
      "tags": [
        "manifest"
      ],
      "spec_section": "10.1",
      "engines": [
        "check"
      ],
      "expect": {
        "command": "check",
        "status": "ok"
      }
    },
    {
      "path": "examples/cells/reach_place/components/pinocchio_fk/manifest-ur5e.inv",
      "intent": "Foreign component manifest pinocchio_fk manifest-ur5e that checks standalone.",
      "family": "foreign-manifest",
      "tags": [
        "manifest"
      ],
      "spec_section": "10.1",
      "engines": [
        "check"
      ],
      "expect": {
        "command": "check",
        "status": "ok"
      }
    },
    {
      "path": "examples/cells/reach_place/components/pinocchio_fk/manifest.inv",
      "intent": "Foreign component manifest pinocchio_fk manifest that checks standalone.",
      "family": "foreign-manifest",
      "tags": [
        "manifest"
      ],
      "spec_section": "10.1",
      "engines": [
        "check"
      ],
      "expect": {
        "command": "check",
        "status": "ok"
      }
    },
    {
      "path": "examples/cells/reach_place/components/process_fixture/manifest.inv",